question,ideal_answer,role,experience,salary_range
"Tell me about a time when you had to work under pressure","In my previous role, we had a critical bug that needed to be fixed before a major client demo. I organized the team, prioritized tasks, and worked extra hours to identify and resolve the issue. We successfully delivered the fix on time and the demo went smoothly.","Software Engineer",3,"80000-120000"
"Describe a situation where you had to learn something new quickly","When our team adopted a new framework, I had only two weeks to learn it before starting a project. I created a learning plan, practiced with tutorials, and built a small prototype. This preparation helped me contribute effectively to the project from day one.","Software Engineer",3,"80000-120000"
"Tell me about a time you disagreed with your manager","I once disagreed with my manager about the technical approach for a project. I prepared a detailed analysis showing the pros and cons of both approaches, presented it respectfully, and we had a productive discussion that led to a better solution combining both ideas.","Software Engineer",3,"80000-120000"
"Describe a time when you had to work with a difficult team member","I worked with a colleague who was resistant to code reviews. I approached them privately, listened to their concerns, and explained the benefits of peer review. I also offered to pair program with them, which helped build trust and improved our collaboration.","Software Engineer",3,"80000-120000"
"Tell me about your biggest professional achievement","I led the development of a new feature that increased user engagement by 40%. I coordinated with multiple teams, managed the technical implementation, and ensured we met all deadlines while maintaining high code quality standards.","Software Engineer",3,"80000-120000"
"Describe a time when you automated a manual process","I noticed our deployment process was taking 2 hours manually and was error-prone. I created a CI/CD pipeline using Jenkins and Docker that reduced deployment time to 15 minutes and eliminated human errors. This saved the team 10+ hours per week.","DevOps Engineer",3,"90000-130000"
"Tell me about a time you had to troubleshoot a production issue","During a critical outage, I quickly identified the root cause as a database connection pool exhaustion. I implemented immediate fixes, scaled resources, and created monitoring alerts. I then conducted a post-mortem to prevent future occurrences.","DevOps Engineer",3,"90000-130000"
"Describe a situation where you improved system reliability","I implemented comprehensive monitoring and alerting for our microservices architecture. This included setting up Prometheus, Grafana dashboards, and PagerDuty integration. System uptime improved from 99.5% to 99.9%.","DevOps Engineer",3,"90000-130000"
"Tell me about a time you had to learn a new technology quickly","When we migrated to Kubernetes, I had to learn container orchestration in 3 weeks. I took online courses, set up a local cluster, and practiced deployments. I successfully led the migration of 5 applications to the new platform.","DevOps Engineer",3,"90000-130000"
"Describe a time when you mentored someone","I mentored a junior DevOps engineer on infrastructure as code practices. I created learning materials, conducted hands-on sessions with Terraform, and provided regular feedback. They became proficient and now manage our staging environment independently.","DevOps Engineer",3,"90000-130000"
"Tell me about a challenging mobile app project you worked on","I developed a real-time chat application with offline capabilities. The challenge was synchronizing messages across devices and handling network interruptions. I implemented local caching, conflict resolution, and background sync, resulting in 99% message delivery reliability.","Mobile Developer",3,"85000-125000"
"Describe a time when you optimized app performance","I noticed our app had slow startup times on older devices. I profiled the code, identified heavy image loading as the bottleneck, implemented lazy loading and image compression. This reduced startup time by 60% and improved user retention.","Mobile Developer",3,"85000-125000"
"Tell me about a time you had to work with designers","I collaborated with UX designers on a complex navigation redesign. We had different perspectives on user flow. I created interactive prototypes to test both approaches with users, and we combined the best elements to create an intuitive design that increased user engagement by 25%.","Mobile Developer",3,"85000-125000"
"Describe a situation where you handled app store rejection","Our app was rejected for violating privacy guidelines. I carefully reviewed the guidelines, updated our privacy policy, implemented proper permission requests, and added clear data usage explanations. The app was approved on resubmission and received positive user feedback.","Mobile Developer",3,"85000-125000"
"Tell me about a time you implemented a new mobile technology","I integrated machine learning capabilities into our photo app using Core ML for iOS and ML Kit for Android. Despite the complexity, I researched best practices, created proof of concepts, and successfully delivered features that improved photo categorization accuracy by 85%.","Mobile Developer",3,"85000-125000"